,Unnamed: 0,topic_name,topic_description,score
0,0,Outdoor Activities,"The user enjoys biking, hiking, and walking. They also like exploring new towns.",0.67909753
3,3,Food and Dining,The user loves eating and trying out food in good restaurants. They prefer not to see many dishes and dislike noise.,0.35170114
4,4,Living Preferences,The user prefers the quiet and peaceful environment of the countryside for living.,0.28861126
1,1,Social Interaction,The user enjoys talking to people and socializing.,0.25024956
2,2,Punctuality,The user values time and dislikes when plans do not happen as scheduled.,0.062061615
